{
  "$schema": "http://json-schema.org/draft-07/schema#",
  "$id": "https://example.github.io/closed-form/schema/entry.schema.json",
  "title": "Closed Form entry (§10 + collection extension)",
  "type": "object",
  "anyOf": [
    { "required": ["explanation"] },
    { "required": ["sections"], "properties": { "sections": { "minItems": 4 } } }
  ],
  "required": [
    "id",
    "status",
    "collection",
    "lab",
    "science",
    "field",
    "aiRole",
    "evidence",
    "headline",
    "scope",
    "plain",
    "doesNot",
    "origin",
    "scorecard",
    "hypeCheck",
    "glossary",
    "sources",
    "sourceHash",
    "sourceCommit"
  ],
  "properties": {
    "id": { "type": "string", "pattern": "^\\d{3}$" },
    "status": { "enum": ["sample", "ai-draft", "ai-checked", "reviewed"] },
    "reviewedBy": { "type": "string" },
    "reviewedAt": { "type": "string" },
    "collection": { "type": "string", "minLength": 1, "example": "openai-math-2026" },
    "lab": { "type": "string", "minLength": 1, "example": "openai" },
    "science": { "type": "string", "minLength": 1, "example": "mathematics" },
    "field": { "type": "string", "minLength": 1, "description": "Must equal the family's catalog subject and scorecard.field." },
    "aiRole": { "enum": ["autonomous", "ai-led", "ai-assisted"] },
    "evidence": {
      "type": "array",
      "minItems": 1,
      "items": {
        "type": "object",
        "required": ["kind", "url"],
        "properties": {
          "kind": { "enum": ["paper", "lean", "trace", "other"] },
          "url": { "type": "string", "format": "uri" },
          "label": { "type": "string" },
          "note": { "type": "string" }
        }
      }
    },
    "headline": { "type": "string", "maxLength": 120 },
    "scope": { "type": "string" },
    "plain": { "type": "string" },
    "doesNot": { "type": "string", "pattern": "^This does not" },
    "origin": {
      "type": "string",
      "const": "This result comes from an unreleased OpenAI model, published in the openai/math release on 6 October 2026."
    },
    "scorecard": {
      "type": "object",
      "required": ["field", "significance", "significanceWhy"],
      "properties": {
        "firstStep": { "type": "string" },
        "firstStepBy": { "type": "string" },
        "field": { "type": "string" },
        "significance": { "enum": ["Landmark", "Major", "Solid", "Niche"] },
        "significanceWhy": { "type": "string" }
      }
    },
    "visual": {
      "type": "object",
      "required": ["type", "title", "points"],
      "properties": {
        "type": { "const": "record" },
        "title": { "type": "string" },
        "note": { "type": "string" },
        "lowerIsBetter": { "type": "boolean" },
        "points": {
          "type": "array",
          "minItems": 1,
          "items": {
            "type": "object",
            "required": ["year", "value", "who", "source"],
            "properties": {
              "year": { "type": "integer" },
              "value": { "type": "number" },
              "who": { "type": "string" },
              "claim": { "type": "boolean" },
              "source": { "type": "integer" }
            }
          }
        }
      }
    },
    "explanation": {
      "type": "string",
      "minLength": 1,
      "description": "Continuous-prose explanation written per prompts/explainer.md: paragraphs separated by one blank line, no headings, no bullets. When present it is the main body and replaces the four fixed sections, which may then be omitted or empty."
    },
    "sections": {
      "type": "array",
      "description": "Legacy body: exactly 4 items titled The story, Why it matters, Where it leads, What it says about AI. Required (4 items) when explanation is absent; omit or leave empty when explanation is present.",
      "minItems": 0,
      "maxItems": 4,
      "items": {
        "type": "object",
        "required": ["title", "body"],
        "properties": {
          "title": { "type": "string" },
          "body": { "type": "string" }
        }
      }
    },
    "hypeCheck": { "type": "string" },
    "glossary": {
      "type": "array",
      "minItems": 3,
      "maxItems": 8,
      "items": {
        "type": "object",
        "required": ["term", "meaning"],
        "properties": {
          "term": { "type": "string" },
          "meaning": { "type": "string" }
        }
      }
    },
    "sources": {
      "type": "array",
      "minItems": 1,
      "items": {
        "type": "object",
        "required": ["id", "cite"],
        "properties": {
          "id": { "type": "integer" },
          "cite": { "type": "string" },
          "url": { "type": "string", "format": "uri" },
          "quote": { "type": "string" },
          "noUrl": { "const": true, "description": "Only when no online copy exists; end cite with \"(no online copy found)\". Every other source needs a url." }
        }
      }
    },
    "claims": {
      "type": "array",
      "items": {
        "type": "object",
        "required": ["text", "verdict"],
        "properties": {
          "text": { "type": "string" },
          "verdict": { "enum": ["supported", "external"] },
          "sourceLine": { "type": "string" },
          "sourceQuote": {
            "type": "string",
            "minLength": 1,
            "description": "Full sentence(s) of the paper LaTeX containing sourceLine, verbatim (comments removed, line breaks as single spaces). Shown to readers for cited claims; filled by pnpm source-quotes."
          },
          "sourceId": { "type": "integer" },
          "paper": { "type": "integer", "minimum": 1 }
        }
      }
    },
    "sourceHash": { "type": "string" },
    "sourceCommit": { "type": "string" },
    "model": {
      "type": "object",
      "required": ["reader", "checker", "date"],
      "properties": {
        "reader": { "type": "string" },
        "checker": { "type": "string" },
        "date": { "type": "string" }
      }
    }
  }
}
