{
  "id": "303",
  "status": "ai-draft",
  "collection": "openai-math-2026",
  "lab": "openai",
  "science": "mathematics",
  "field": "Operator algebras",
  "aiRole": "autonomous",
  "evidence": [
    {
      "kind": "paper",
      "url": "https://github.com/openai/math/blob/main/preprints/Weak-pure-infiniteness-and-O-infinity-absorption-September-25-2026/paper.pdf",
      "label": "Weak pure infiniteness and O-infinity absorption"
    },
    {
      "kind": "lean",
      "url": "https://github.com/openai/math/blob/main/lean/docs/303.md",
      "label": "Lean scope note"
    }
  ],
  "headline": "Proves pure infiniteness implies strong pure infiniteness in all C*-algebras, part of a Kirchberg–Rørdam question.",
  "scope": "All complex C*-algebras, including nonunital and nonseparable ones; the fixed-amplification result is for exact algebras, and O∞ absorption for separable nuclear ones.",
  "plain": "In some operator algebras, an element can hold two full copies of itself, like an infinite hotel that houses two groups of guests. Kirchberg and Rørdam defined weak, ordinary and strong versions of this property and asked whether they agree. This paper proves ordinary implies strong for every C*-algebra, and that weak implies ordinary for exact algebras. Lean checks both results. For separable nuclear algebras, it follows that they absorb the Cuntz algebra O∞.",
  "doesNot": "This does not show that weak pure infiniteness implies ordinary pure infiniteness for algebras that are not exact.",
  "origin": "This result comes from an unreleased OpenAI model, published in the openai/math release on 6 October 2026.",
  "scorecard": {
    "firstStep": "2002",
    "firstStepBy": "Kirchberg and Rørdam, who introduced weak and strong pure infiniteness and posed Question 9.5",
    "field": "Operator algebras",
    "significance": "Major",
    "significanceWhy": "It answers the ordinary-to-strong part of a Kirchberg–Rørdam question in general, and the full question for exact algebras, with Lean checks."
  },
  "explanation": "Take the space of infinite sequences with basis vectors e0, e1, e2, and so on. Let S1 send e_n to e_(2n) and S2 send e_n to e_(2n+1). So S1 sends e3 to e6, and S2 sends e3 to e7. Each map keeps lengths. S1 fills the even slots and S2 fills the odd slots, with no overlap. So the identity holds two full copies of itself side by side. Matrices cannot do this: two copies of the k-by-k identity have trace 2k, more than k.\n\nA C*-algebra is a family of operators closed under sums, products, adjoints and limits. A positive element h is properly infinite when h ⊕ h fits below h in the sense of Cuntz comparison[5]. Cuntz comparison means h ⊕ h can be squeezed into h by operators, up to small errors. Pure infiniteness asks this for every positive element. Weak pure infiniteness asks it only after taking n copies of each element, for one fixed n. Strong pure infiniteness also requires two elements to be cut apart at once, with their mixed entry made small[6]. Strong implies ordinary, and ordinary implies weak. Kirchberg and Rørdam asked whether the reverse implications hold[7]. The obstacle is the mixed entry. Knowing each element alone is infinite says nothing direct about how two elements interact.\n\nThe paper proves that if every positive element is properly infinite, the algebra is strongly purely infinite[1]. It needs no exactness, nuclearity, unitality or simplicity. For exact algebras, it proves that the fixed-amplification property already makes every positive element properly infinite[2]. Exact algebras are a large, well-behaved class defined through tensor products. So all three notions agree for exact algebras[3]. Combined with earlier results of Kirchberg and Rørdam, every separable nuclear algebra with the fixed-amplification property absorbs O∞[4]. Absorbing O∞ means A ⊗ O∞ is again A, where O∞ is generated by infinitely many isometries like S1 and S2.\n\nHow sure is this? Lean, a computer proof checker, has formal statements of the two main theorems. They are the ordinary-to-strong implication and the fixed-amplification result for exact algebras. So the paper proves both, as far as the Lean statements match the paper. The O∞ absorption step uses earlier published results. No specialist review is published.",
  "hypeCheck": "A solid answer to a listed question, with Lean checks of both main theorems. The weak-to-ordinary step for nonexact algebras stays open. No specialist review is published.",
  "glossary": [
    {
      "term": "C*-algebra",
      "meaning": "A family of operators on a Hilbert space closed under sums, products, adjoints and limits."
    },
    {
      "term": "Cuntz comparison",
      "meaning": "A way to say one positive element fits below another, by squeezing it with operators up to small errors."
    },
    {
      "term": "Properly infinite element",
      "meaning": "A positive element h with h ⊕ h fitting below h in Cuntz comparison."
    },
    {
      "term": "Pure infiniteness",
      "meaning": "Every positive element of the algebra is properly infinite."
    },
    {
      "term": "Strong pure infiniteness",
      "meaning": "Any two positive elements can be cut apart at once, with their mixed entry made arbitrarily small."
    },
    {
      "term": "Exact C*-algebra",
      "meaning": "An algebra whose minimal tensor product preserves short exact sequences; a large, well-behaved class."
    },
    {
      "term": "Cuntz algebra O∞",
      "meaning": "The C*-algebra generated by infinitely many isometries with mutually orthogonal ranges."
    },
    {
      "term": "Isometry",
      "meaning": "An operator that keeps the length of every vector."
    }
  ],
  "sources": [
    {
      "id": 1,
      "cite": "OpenAI, “Weak pure infiniteness and O-infinity absorption” (25 September 2026)",
      "url": "https://github.com/openai/math/blob/main/preprints/Weak-pure-infiniteness-and-O-infinity-absorption-September-25-2026/paper.pdf"
    },
    {
      "id": 2,
      "cite": "openai/math, Lean scope note for family 303",
      "url": "https://github.com/openai/math/blob/main/lean/docs/303.md",
      "quote": "No exactness, nuclearity, unitality, or simplicity assumption is needed for this implication."
    },
    {
      "id": 3,
      "cite": "openai/math release notes (2026): model provenance and review status",
      "url": "https://github.com/openai/math/blob/main/README.md",
      "quote": "manuscripts and supporting proof artifacts produced by an internal OpenAI model"
    }
  ],
  "sourceHash": "TBD",
  "sourceCommit": "fd4aeeb2ee4fc729c18d98444fed42fd0529eeeb",
  "claims": [
    {
      "text": "Every complex C*-algebra in which each positive element is properly infinite is strongly purely infinite.",
      "sourceLine": "We prove that every complex \\(C^*\\)-algebra in which each positive",
      "sourceQuote": "We prove that every complex \\(C^*\\)-algebra in which each positive element is properly infinite is strongly purely infinite.",
      "verdict": "supported"
    },
    {
      "text": "For exact algebras, proper infiniteness of one fixed amplification of every positive element implies proper infiniteness of each positive element.",
      "sourceLine": "For exact algebras, we also prove that proper infiniteness of one fixed",
      "sourceQuote": "For exact algebras, we also prove that proper infiniteness of one fixed finite amplification of every positive element implies proper infiniteness of each positive element.",
      "verdict": "supported"
    },
    {
      "text": "The theorems answer the ordinary-to-strong part of Problem LXXII in general and the full question for exact algebras.",
      "sourceLine": "These theorems give a positive answer to the ordinary-to-strong part",
      "sourceQuote": "These theorems give a positive answer to the ordinary-to-strong part of Problem~LXXII in general and to the full comparison question for exact algebras, hence also for nuclear algebras.",
      "verdict": "supported"
    },
    {
      "text": "Every separable nuclear algebra with the fixed-amplification property absorbs O∞.",
      "sourceLine": "with this fixed-amplification property absorbs",
      "sourceQuote": "Consequently, every separable nuclear algebra with this fixed-amplification property absorbs \\(\\Oinf\\), without assumptions of unitality or simplicity.",
      "verdict": "supported"
    },
    {
      "text": "A positive element h is properly infinite if h ⊕ h ≾ h.",
      "sourceLine": "\\emph{properly infinite} if \\(h\\oplus h\\precsim h\\).",
      "sourceQuote": "A positive element \\(h\\) is \\emph{properly infinite} if \\(h\\oplus h\\precsim h\\).",
      "verdict": "supported"
    },
    {
      "text": "Simultaneous comparison of two elements must also control a mixed entry.",
      "sourceLine": "the latter must also control a mixed entry.",
      "sourceQuote": "For a nonsimple algebra, an individual comparison and the simultaneous comparison of two elements are different demands: the latter must also control a mixed entry.",
      "verdict": "supported"
    },
    {
      "text": "The reverse implications form the comparison question in Kirchberg–Rørdam's Question 9.5.",
      "sourceLine": "The reverse implications form the comparison question in",
      "sourceQuote": "The reverse implications form the comparison question in Kirchberg--R{\\o}rdam's Question~9.5, as recalled in \\cite[Section~21, Problem~LXXII]{STW99problems}.",
      "verdict": "supported"
    },
    {
      "text": "Lean formalizes the ordinary-to-strong implication for all C*-algebras and the fixed-amplification result for exact algebras; the O∞ absorption corollary is outside.",
      "verdict": "external",
      "sourceId": 2
    },
    {
      "text": "An internal OpenAI model produced the manuscript.",
      "verdict": "external",
      "sourceId": 3
    }
  ]
}
